{
  "type": "FREE_CODING",
  "id": "module-08-lesson-05-challenge-3",
  "title": "Interactive Exercise: Build a User Registration Validator",
  "description": "Create a user registration validator that checks:\n1. **Username:** 3-20 characters, alphanumeric only, not empty\n2. **Email:** Valid format (contains @ and .)\n3. **Age:** Integer between 13-120\n4. **Password:** At least 8 characters\n\nReturn True if all valid, raise appropriate exceptions if any validation fails.\n\n**Your task:**\nImplement validate_registration() with comprehensive validation.\n\n**Starter code:**",
  "instructions": "Create a user registration validator that checks:\n1. **Username:** 3-20 characters, alphanumeric only, not empty\n2. **Email:** Valid format (contains @ and .)\n3. **Age:** Integer between 13-120\n4. **Password:** At least 8 characters\n\nReturn True if all valid, raise appropriate exceptions if any validation fails.\n\n**Your task:**\nImplement validate_registration() with comprehensive validation.\n\n**Starter code:**",
  "language": "python",
  "testCases": [
    {
      "id": "test-1",
      "description": "Code runs without errors",
      "expectedOutput": "",
      "isVisible": true
    }
  ],
  "hints": [
    {
      "level": 1,
      "text": "Use if not username.strip(): for empty check, if not 3 <= len(username) <= 20: for length, if not username.isalnum(): for alphanumeric check. Similar pattern for other fields."
    }
  ],
  "commonMistakes": [
    {
      "mistake": "Forgetting the colon after if/for/while",
      "consequence": "SyntaxError",
      "correction": "Add : at the end of the line"
    },
    {
      "mistake": "Using = instead of == for comparison",
      "consequence": "Assignment instead of comparison",
      "correction": "Use == for equality checks"
    },
    {
      "mistake": "Incorrect indentation",
      "consequence": "IndentationError",
      "correction": "Use consistent 4-space indentation"
    }
  ],
  "difficulty": "beginner"
}