{
  "type": "FREE_CODING",
  "id": "3.1.1",
  "title": "Create a Simple Class",
  "description": "Create a class called `Book` with properties for title (String), author (String), and pages (Int). Create an instance and print its properties.",
  "instructions": "Create a class called `Book` with properties for title (String), author (String), and pages (Int). Create an instance and print its properties.",
  "language": "kotlin",
  "testCases": [
    {
      "id": "test-1",
      "description": "Book class should exist with correct properties",
      "expectedOutput": "Title:",
      "isVisible": true
    }
  ],
  "hints": [
    {
      "level": 1,
      "text": "Use the class keyword followed by the class name"
    },
    {
      "level": 2,
      "text": "Define properties in the primary constructor"
    },
    {
      "level": 3,
      "text": "Use val for read-only properties"
    },
    {
      "level": 4,
      "text": "Access properties using dot notation"
    }
  ],
  "commonMistakes": [
    {
      "mistake": "Forgetting null safety operators",
      "consequence": "NullPointerException",
      "correction": "Use ?. for safe calls, ?: for elvis operator"
    },
    {
      "mistake": "Using var when val would suffice",
      "consequence": "Unnecessary mutability",
      "correction": "Prefer val for immutable values"
    },
    {
      "mistake": "Incorrect string interpolation",
      "consequence": "Syntax error",
      "correction": "Use $variable or ${expression}"
    }
  ],
  "difficulty": "intermediate"
}