{
  "type": "FREE_CODING",
  "id": "capstone-16-9-dockerfile",
  "title": "Create a Production Dockerfile",
  "description": "Write a multi-stage Dockerfile for the Spring Boot application with security best practices.",
  "instructions": "Create a Dockerfile that:\n1. Uses Gradle 8.5 with JDK 21 for the build stage\n2. Uses Eclipse Temurin 21 JRE Alpine for the runtime\n3. Creates a non-root user called 'appuser'\n4. Includes a HEALTHCHECK instruction\n5. Exposes port 8080",
  "language": "dockerfile",
  "testCases": [],
  "hints": [
    {
      "level": 1,
      "text": "Use 'AS builder' to name the first stage, then 'COPY --from=builder' to copy from it."
    },
    {
      "level": 2,
      "text": "On Alpine Linux, use addgroup -S and adduser -S for system users."
    }
  ],
  "difficulty": "intermediate"
}