{
  "type": "FREE_CODING",
  "id": "lesson-03-01-challenge-01",
  "title": "Practice Challenge",
  "description": "Apply what you've learned in this interactive coding challenge.",
  "instructions": "Create a simple age verification system:\n\n1. Create an int variable called 'playerAge' and set it to any number\n2. Use an if statement to check if playerAge is >= 13\n3. If true, display: 'Welcome to the game!'\n4. After the if statement, always display: 'Thank you for visiting'\n\nTry changing playerAge to different values and see what happens!",
  "language": "csharp",
  "testCases": [
    {
      "id": "test-1",
      "description": "Output should contain \"Thank you for visiting\"",
      "expectedOutput": "Thank you for visiting",
      "isVisible": true
    }
  ],
  "hints": [
    {
      "level": 1,
      "text": "Remember: if (condition) { code to run if true }. The condition should be playerAge >= 13. Don't forget the curly braces!"
    },
    {
      "level": 2,
      "text": "Forgetting parentheses around the condition: if age >= 13 is WRONG! Must be if (age >= 13)"
    },
    {
      "level": 3,
      "text": "Forgetting curly braces: While you CAN skip them for one line, it's bad practice. Always use { }!"
    },
    {
      "level": 4,
      "text": "Using = instead of ==: if (age = 13) ASSIGNS 13 to age! Use == to COMPARE: if (age == 13)"
    },
    {
      "level": 5,
      "text": "Putting a semicolon after the if: if (age >= 13); is WRONG! No semicolon before the { }"
    }
  ],
  "commonMistakes": [
    {
      "mistake": "Forgetting parentheses around the condition",
      "consequence": "if age >= 13 is WRONG! Must be if (age >= 13)",
      "correction": "Review the correct syntax and best practices for this concept."
    },
    {
      "mistake": "Forgetting curly braces",
      "consequence": "While you CAN skip them for one line, it's bad practice. Always use { }!",
      "correction": "Review the correct syntax and best practices for this concept."
    },
    {
      "mistake": "Using = instead of ==",
      "consequence": "if (age = 13) ASSIGNS 13 to age! Use == to COMPARE: if (age == 13)",
      "correction": "Review the correct syntax and best practices for this concept."
    },
    {
      "mistake": "Putting a semicolon after the if",
      "consequence": "if (age >= 13); is WRONG! No semicolon before the { }",
      "correction": "Review the correct syntax and best practices for this concept."
    }
  ],
  "difficulty": "beginner"
}