{
  "type": "FREE_CODING",
  "id": "15.4-challenge",
  "title": "Practice Challenge",
  "description": "Create an environment configuration system:\n\n1. Create a `Config` class that:\n   - Loads variables from process.env\n   - Validates required variables\n   - Provides get() method with fallbacks\n   - Masks secrets when displaying\n\n2. Test with sample environment variables",
  "instructions": "Create an environment configuration system:\n\n1. Create a `Config` class that:\n   - Loads variables from process.env\n   - Validates required variables\n   - Provides get() method with fallbacks\n   - Masks secrets when displaying\n\n2. Test with sample environment variables",
  "language": "javascript",
  "testCases": [
    {
      "id": "test-1",
      "description": "Should detect missing required variables",
      "expectedOutput": "false (missing JWT_SECRET)",
      "isVisible": true
    }
  ],
  "hints": [
    {
      "level": 1,
      "text": "Use process.env to access environment variables"
    }
  ],
  "commonMistakes": [
    {
      "mistake": "Committing .env to Git",
      "consequence": "Secrets are exposed in git history, even if deleted later (security breach).",
      "correction": "Add .env to .gitignore before your first commit. Rotate any leaked secrets immediately."
    },
    {
      "mistake": "Forgot to load dotenv",
      "consequence": "process.env variables are undefined, causing app crashes.",
      "correction": "Import dotenv at the very top: import 'dotenv/config'; before other imports."
    }
  ],
  "difficulty": "beginner"
}