{
  "type": "MULTIPLE_CHOICE",
  "id": "lesson-15-3-api-design",
  "title": "RESTful URL Design",
  "description": "Which URL follows REST best practices for getting user 123's orders?",
  "options": [
    "GET /getUserOrders?id=123",
    "GET /users/123/orders",
    "POST /orders/getByUser/123",
    "GET /api/fetch-orders-for-user-123"
  ],
  "correctAnswer": 1,
  "explanation": "REST uses nouns (resources) and nesting. /users/123/orders is resource-oriented. Verbs belong in HTTP methods, not URLs."
}